Unnamed: 0,SriLanka_creole,phonetic_transcription,Portuguese_definition,Portuguese_IPA,English_definition,pos,Related_languages,pt_related annotations,sources,original_full_entry,original_Portuguese_definition,original_linguistic_notes,page
0,Abaço,abaso,abaixo,ɐ.ˈbaj.ʃu,below,adverb,,,,"Abaço, abaixo. P. us. V.",abaixo,pouco usado,135.0
1,Aberçà,abeɾsaː,abraçar,ɐ.bɾɐ.ˈsaɾ,hug,verb,,,"O Bruffador, ii periódico","Aberçà, abersà, aburçá {Br. 2), abraçar.",abraçar,,135.0
2,abersà,abeɾsaː,abraçar,ɐ.bɾɐ.ˈsaɾ,hug,verb,,,"O Bruffador, ii periódico","Aberçà, abersà, aburçá {Br. 2), abraçar.",abraçar,,135.0
3,aburçá,abuɾsaː,abraçar,ɐ.bɾɐ.ˈsaɾ,hug,verb,,,"O Bruffador, ii periódico","Aberçà, abersà, aburçá {Br. 2), abraçar.",abraçar,,135.0
4,Aburcé,abuɾseː,aborrecer,ɐ.bu.Rɨ.ˈseɾ,annoy,verb,,,,Aburcé. Mais us. burcé.,Mesmo que burcé,,135.0
6,Aborcido,aboɾsido,aborrecido,ɐ.bu.Rɨ.ˈsi.du,bored,adjective,,,,Aborcido. P. us. V. borcido.,borcido,pouco usado,135.0
7,Absença,absensa,ausência,aw.ˈzẽ.sjɐ,absence,noun,,,,"Absença {b pron.), ausência.— íngl. absence.",ausência,,135.0
11,Acá,akaː,cá,ˈka,here,adverb,,Old Portuguese,,"Acá, cá. — Port. arch. Elii-cid.: acó e aqó. Cfr. alá.",cá,,135.0
22,Açorague,asoɾage,açougue,ɐ.ˈsow.ɡɨ,butchery,noun,,,,"Açorague, açougue. — Por equivocação com a^orrague (desus.)?",açougue,,135.0
26,Adéo,adeːo,adeus,ɐ.ˈdewʃ,goodbye,noun,,,,"Adéo, adeus. 5 apocopado, por se considerar a locução simples e singular. Cfr. simple.",adeus,,135.0
27,Adiôto,adioːto,douto,ˈdow.tu,learned,noun,,,Istori de San Clear,"Adiôto (S. C), douto.",douto,,135.0
34,Adultéria,adulteːɾia,adultério,ɐ.duɫ.tˈɛ.ɾi.u,adultery,noun,,,,"Adultéria, adulteração, adultério. Cfr. mystéria; cui-dação.",adultério,,136.0
35,adulteração,adulteɾasaːo,adultério,ɐ.duɫ.tˈɛ.ɾi.u,adultery,noun,,,,"Adultéria, adulteração, adultério. Cfr. mystéria; cui-dação.",adultério,,136.0
41,Affeçan,afesan,afeição,ɐ.fɐj.ˈsɐ̃w̃,affection,noun,,,,"Affeçan, aífeição.",aífeição,,136.0
43,Ágô,aːgoː,água,a.gwɐ,water,noun,"Capeverdean creole, Cochin creole, Macao creole",,,"Ágo (fórm. mod.), agoe, (p. uspron. ágô)^ agua (t. us.). Ago: dial. cochmac, cab. Cfr. lingo, lego.",água,pouco usado,136.0
47,Agradado,agɾadado,agradável,ɐ.ɡɾɐ.ˈda.vɛɫ,pleasant,adjective,,,,"Agradado, agradável. Cfr. desobedecido, perfeitado.",agradável,,136.0
48,Aguá,aguaː,voar,ˈvwaɾ,fly,verb,Macao creole,,,"Agua, aguvá, voar. Agua: dial. mac.—Por avoá, q. v. Cfr. nôgo, ôgo.",voar,,136.0
49,aguvá,aguʋaː,voar,ˈvwaɾ,fly,verb,Macao creole,,,"Agua, aguvá, voar. Agua: dial. mac.—Por avoá, q. v. Cfr. nôgo, ôgo.",voar,,136.0
50,Aindè,aindeː,ainda,ɐ.ˈĩ.dɐ,still,adverb,,,,"Aindè, ainda. Mais us. indè.",ainda,,136.0
55,Albre,albɾe,árvore,ˈaɾ.vu.ɾɨ,tree,noun,"Capeverdean creole, Macao creole",Old Portuguese,,"Albre, àlbri, àlbir (fórm. mod.), arvore. Albre: dial. cab. Dial. mac. árvi. Arbre, arbe e arve (e alvoredo): dia-lectaes no Portuguese-based creoles of Indian mainland. — Albo-re: port. arch.",árvore,,136.0
56,àlbri,aːlbɾi,árvore,ˈaɾ.vu.ɾɨ,tree,noun,"Capeverdean creole, Macao creole",Old Portuguese,,"Albre, àlbri, àlbir (fórm. mod.), arvore. Albre: dial. cab. Dial. mac. árvi. Arbre, arbe e arve (e alvoredo): dia-lectaes no Portuguese-based creoles of Indian mainland. — Albo-re: port. arch.",árvore,,136.0
57,àlbir,aːlbiɾ,árvore,ˈaɾ.vu.ɾɨ,tree,noun,"Capeverdean creole, Macao creole",Old Portuguese,,"Albre, àlbri, àlbir (fórm. mod.), arvore. Albre: dial. cab. Dial. mac. árvi. Arbre, arbe e arve (e alvoredo): dia-lectaes no Portuguese-based creoles of Indian mainland. — Albo-re: port. arch.",árvore,,136.0
59,Aldia,aldia,aldeia,aɫ.ˈdɐj.ɐ,village,noun,,,,"Aldia, aldeia. Cfr. ária, cadia.",aldeia,,136.0
60,Alegrado,alegɾado,alegre,ɐ.ˈlɛ.ɡɾɨ,merry,adjective,,,,"Alegrado, alegre. Cfr. agradado.",alegre,,136.0
61,Alegroso,alegɾozo,alegre,ɐ.ˈlɛ.ɡɾɨ,merry,adjective,,,,"Alegroso, alegre. Cfr. se-rioso, varioso.",alegre,,136.0
64,Alfada,alfada,almofada,aɫ.mu.ˈfa.dɐ,cushion,noun,,,,"Alfada, almofada.— Por al-m'fada (assimil.).",almofada,,136.0
65,Alfàndago,alfaːndago,alfândega,aɫ.ˈfɐ̃.dɨ.ɡɐ,customs,noun,,,,"Alfàndago, alfandega.",alfandega,,136.0
66,Alfiato,alfiato,alfaiate,aɫ.fɐj.ˈa.tɨ,tailor,noun,,,,"Alfiato, alfaiate. Alfiate: dial. de Mahé.",alfaiate,,136.0
71,Alhuma,aʎuma,alguém,aɫ.ˈɡɐ̃j̃,someone,pronoun,,,,,alguém,,136.0
77,Allagre,alagɾe,alegre,ɐ.ˈlɛ.ɡɾɨ,merry,adjective,,,,,alegre,,136.0
78,allagroso,alagɾozo,alegre,ɐ.ˈlɛ.ɡɾɨ,merry,adjective,,,,,alegre,,136.0
79,allegrioso,alegɾiozo,alegre,ɐ.ˈlɛ.ɡɾɨ,merry,adjective,,,,,alegre,,136.0
80,Allagria,alagɾia,alegria,ɐ.lɨ.ˈɡɾi.ɐ,joy,noun,,,,"Allegri, alegria (t. us.). Cfr. caristi.",alegria,,136.0
81,allegri,alegɾi,alegria,ɐ.lɨ.ˈɡɾi.ɐ,joy,noun,,,,"Allegri, alegria (t. us.). Cfr. caristi.",alegria,,136.0
82,Almári,almaːɾi,armário,ɐɾ.ˈma.ɾju,cabinet,noun,,,,"Almári, almario, armário. Cfr. peditóri, remedi.",armário,,136.0
83,Almazem,almazem,armazém,ɐɾ.mɐ.ˈʒɐ̃j̃,warehouse,noun,,"Old Portuguese, Dialectal Portuguese",,"Almazem, armazém.—Port. arch. e Dialetal Portuguese. Mais us. gudão.",armazém,,136.0
84,Almóça,almoːsa,almoço,aɫ.ˈmo.su,lunch,noun,,,,"Almoça, almoço.",almoço,,136.0
87,Alumado,alumado,aluado,ɐ.ˈlwa.du,moonstruck,adjective,,,,"Alumado, aluado. Mais us. l untado.",aluado,,137.0
88,Aluminá,aluminaː,iluminar,i.lu.mi.ˈnaɾ,illuminate,verb,,,,"Aluminá, illuminar.",illuminar,,137.0
89,Alverção,alʋeɾsaːo,aversão,ɐ.vɨɾ.ˈsɐ̃w̃,aversion,noun,,,Cantigas,Alverção (Cant.)^ aversão.,aversão,,137.0
90,Alvorsà,alʋoɾsaː,alvoroçar,aɫ.vu.ɾu.ˈsaɾ,fuss,verb,,,,"Alvorsà, alversá, alvoroçar.",alvoroçar,,137.0
91,alversá,alʋeɾsaː,alvoroçar,aɫ.vu.ɾu.ˈsaɾ,fuss,verb,,,,"Alvorsà, alversá, alvoroçar.",alvoroçar,,137.0
92,Alvoroção,alʋoɾosaːo,alvoroço,aɫ.vu.ˈɾo.su,uproar,noun,,,"O Bruffador, i periódico","Alvoroção (deriv. norm.), alvroço {Br. i), alvoroço.",alvoroço,derivado,
93,alvroço,alʋɾoso,alvoroço,aɫ.vu.ˈɾo.su,uproar,noun,,,"O Bruffador, i periódico","Alvoroção (deriv. norm.), alvroço {Br. i), alvoroço.",alvoroço,derivado,
96,Amanhão,amaɲaːo,amanhã,a.mɐ.ˈɲɐ̃,tomorrow,adverb,Diu creole,"Dialectal Portuguese Minho, Porto",,"Amanhão, aminhão, amião, amiam (p. us.), amanhã. Dial. div. aminhâ. Ama-nhão, aminhão: Dialetal Portuguese. no Minho e no Porto. Cfr. palmião, Ião.",amanhã,,137.0
97,aminhão,amiɲaːo,amanhã,a.mɐ.ˈɲɐ̃,tomorrow,adverb,Diu creole,"Dialectal Portuguese Minho, Porto",,"Amanhão, aminhão, amião, amiam (p. us.), amanhã. Dial. div. aminhâ. Ama-nhão, aminhão: Dialetal Portuguese. no Minho e no Porto. Cfr. palmião, Ião.",amanhã,,137.0
98,amião,amiaːo,amanhã,a.mɐ.ˈɲɐ̃,tomorrow,adverb,Diu creole,"Dialectal Portuguese Minho, Porto",,"Amanhão, aminhão, amião, amiam (p. us.), amanhã. Dial. div. aminhâ. Ama-nhão, aminhão: Dialetal Portuguese. no Minho e no Porto. Cfr. palmião, Ião.",amanhã,,137.0
99,amiam,amiam,amanhã,a.mɐ.ˈɲɐ̃,tomorrow,adverb,Diu creole,"Dialectal Portuguese Minho, Porto",,"Amanhão, aminhão, amião, amiam (p. us.), amanhã. Dial. div. aminhâ. Ama-nhão, aminhão: Dialetal Portuguese. no Minho e no Porto. Cfr. palmião, Ião.",amanhã,,137.0
100,Amaroso,amaɾozo,amoroso,ɐ.mu.ˈɾo.zu,loving,adjective,,,"O Bruffador, ii periódico","Amaroso, ameroso (p. us.), amoro {Br. 2), amoroso.—Infl. de r. Cfr. sabaroso. Amaroso-mente, amorosamente.",amoroso,pouco usado,137.0
101,ameroso,ameɾozo,amoroso,ɐ.mu.ˈɾo.zu,loving,adjective,,,"O Bruffador, ii periódico","Amaroso, ameroso (p. us.), amoro {Br. 2), amoroso.—Infl. de r. Cfr. sabaroso. Amaroso-mente, amorosamente.",amoroso,pouco usado,137.0
102,amoro,amoɾo,amoroso,ɐ.mu.ˈɾo.zu,loving,adjective,,,"O Bruffador, ii periódico","Amaroso, ameroso (p. us.), amoro {Br. 2), amoroso.—Infl. de r. Cfr. sabaroso. Amaroso-mente, amorosamente.",amoroso,pouco usado,137.0
105,Amiçan,amisan,ambição,ɐ̃.bi.ˈsɐ̃w̃,ambition,noun,,,,"Amiçan, ambição. Ass. do b. á nasal precedente. Cfr. amos.",ambição,,137.0
110,Ampér,ampeːɾ,amparo,ɐ̃.ˈpa.ɾu,amparo,noun,,,Cantigas,Ampér {Cant.)^ amparo.,amparo,,137.0
114,Anela,anela,anel,ɐ.ˈnɛɫ,ring,noun,Macao creole,,,"Anela, anel. Dial. de Mahé, mac. Cfr. papeia.",anel,,137.0
115,Anima,anima,ânimo,ˈɐ.ni.mu,cheer,noun,,,,"Anima, animo. Cfr. almoça.",animo,,137.0
121,Ankerà,ankeɾaː,ancorar,ɐ̃.ku.ˈɾaɾ,anchor,verb,,,,"Ankerà, anchrà,, ancrà, an-chorar,",ancorar,,137.0
122,ancrà,ankɾaː,ancorar,ɐ̃.ku.ˈɾaɾ,anchor,verb,,,,"Ankerà, anchrà,, ancrà, an-chorar,",ancorar,,137.0
132,Apinhá,apiɲaː,apanhar,ɐ.pɐ.ˈɲaɾ,catch,verb,,,,"Apinha, apanhar. T. panhà. Cfr. accompinhá.",apanhar,,137.0
137,Aquél,akeːl,aquilo,ɐ.ˈki.lu,aquilo,pronoun,,,,"Aquél, aquelle, aquillo; o. Aquelhora (/-A), aquella hora: então. Dial. coch. Aquelvidè, por causa d'aquillo: por isso, por tanto. V. vide.",aquillo,,137.0
138,aquelle,akele,aquilo,ɐ.ˈki.lu,aquilo,pronoun,,,,"Aquél, aquelle, aquillo; o. Aquelhora (/-A), aquella hora: então. Dial. coch. Aquelvidè, por causa d'aquillo: por isso, por tanto. V. vide.",aquillo,,137.0
141,Ária,aːɾia,areia,ɐ.ˈɾɐj.ɐ,sand,noun,Macao creole,,,"Ária, areia. Dial. mac. Cfr. aldia, cadia.",areia,,138.0
142,Arià,aɾiaː,variar,vɐ.ˈɾi.aɾ,vary,verb,,,,"Arià, variar. Ariado, variado, vario. Ariação, variação.",variar,,138.0
145,Aros,aɾos,arroz,ɐ.ˈʁoʃ,rice,noun,,,,"Aros, arroz. Aro^: Chr. de Bisn.",arroz,,138.0
149,Artifiço,aɾtifiso,artifício,ɐɾ.ti.ˈfi.sju,artifice,noun,,,,"Artifiço, artificio. Cfr. pa-laço, sacrifico.",artificio,,138.0
151,Ásper,aːspeɾ,áspero,ˈaʃ.pɨ.ɾu,rough,adjective,,,,"Ásper, áspero. Cfr. vésper, témper. Asperà, tornar-se áspero, esbravejar. Asperdade, aspereza. Cfr. altividade, duvi-dade.",áspero,,138.0
153,Asperdade,aspeɾdade,aspereza,ɐʃ.pɨ.ˈɾe.zɐ,rough protuberances,noun,,,,,aspereza,,
157,Assitanto,asitanto,tanto,ˈtɐ̃.tu,so much,adverb,,,,,tanto,,
158,astanto,astanto,tanto,ˈtɐ̃.tu,as much,adverb,,,,,tanto,,
159,Assino,asino,assinatura,ɐ.si.nɐ.ˈtu.ɾɐ,signature,noun,,,,"Assino, assignatura. — Do verbo assina. Cfr. ruino.",assignatura,,138.0
160,Assofran,asofɾan,açafrão,ɐ.sɐ.ˈfɾɐ̃w̃,saffron,noun,,,,"Assofran, açafrão. Asso-frà, açafroar.",açafrão,,138.0
162,Atà,ataː,até,ɐ.ˈtɛ,until,adverb,,Old Portuguese,,"Atà, até (t. us.). — Port. arch.",até,,138.0
163,Atarde,ataɾde,tarde,ˈtaɾ.dɨ,afternoon,adverb,,,,"Atarde, tarde.—De á tarde. Cfr. anoute, dedia.",tarde,,138.0
164,Atchà,at̠ʃaː,achar,ɐ.ˈʃaɾ,find,verb,Macao creole,,,"Atchà, achar (mais us.). Dial. mac. Cfr. fitchá.",achar,,138.0
166,Atramento,atɾamento,atrevimento,ɐ.tɾɨ.vi.ˈmẽ.tu,dare,noun,,,,"Atramento, atrevimento. Atramentá, atrever-se.",atrevimento,,138.0
171,Attermesan,atːeɾmezan,altercação,aɫ.tɨɾ.kɐ.ˈsɐ̃w̃,quarrel,noun,,,Istori de San Clear,"Attermesan (5. C), altercação ?",altercação,,138.0
172,Audénci,audeːnsi,audiência,aw.ˈdjẽ.sjɐ,hearing,noun,,,,"Audénci, audiência. Cfr./&gt;a-cénci, comedi.",audiência,,138.0
173,Audia,audia,audácia,aw.ˈda.sjɐ,audacity,noun,,,Cantigas,"Audia (Cant.), audácia ?",audácia,,138.0
175,Avantagem,aʋantad̠ʒem,vantagem,vɐ̃.ˈta.ʒɐ̃j̃,advantage,noun,,Old Portuguese,,"Avantagem (A^. T.), vantagem.— Port. arch.",vantagem,,138.0
176,Avelho,aʋeʎo,abelha,ɐ.ˈbɐj.ʎɐ,bee,noun,,,,"Avelho, abelha.",abelha,,138.0
177,Avená,aʋenaː,abanar,ɐ.bɐ.ˈnaɾ,shake,verb,,,,"Avena, abanar.",abanar,,138.0
178,Avoà,aʋoaː,voar,ˈvwaɾ,fly,verb,,"Old Portuguese, Dialectal Portuguese",,"Avoà, voar. — Port. arch. e Dialetal Portuguese.",voar,,138.0
182,Azéte,azeːte,azeite,ɐ.ˈzɐj.tɨ,olive oil,noun,,,"O Bruffador, i periódico","Azéte, aziete {Br. i), azeite. Azeitero, azietero {Br. i), azeiteiro. Azeitero: Dial. mac.",azeite,,138.0
183,aziete,aziete,azeite,ɐ.ˈzɐj.tɨ,olive oil,noun,,,"O Bruffador, i periódico","Azéte, aziete {Br. i), azeite. Azeitero, azietero {Br. i), azeiteiro. Azeitero: Dial. mac.",azeite,,138.0
189,Baclà,baklaː,batalhar,bɐ.tɐ.ˈʎaɾ,battle,verb,,,,"Baclà, batalhar. Baclador, batalhador. Bacladura, bacal-dura, (p. us.), batalha, combate. — Por intermédio de *bat'lá.",batalhar,,139.0
194,Bailo,bailo,baile,ˈbaj.lɨ,"ball, dance",noun,,Dialectal Portuguese,,"Bailo, baile. — Port. Dialetal Portuguese. Bailo-casa, casa de baile.",baile,,139.0
198,Basséza,baseːza,baixeza,baj.ˈʃe.zɐ,baseness,noun,,,,,baixeza,,
206,Bandeya,bandeja,bandeja,bɐ̃.ˈdɐj.ʒɐ,tray,noun,,,,"Bandeya, bandeja.",bandeja,,139.0
215,Barrato,barato,barato,bɐ.ˈɾa.tu,cheap,adjective,,,,"Barrato, barato. Cfr. carro.",barato,,139.0
216,Barrê,bareː,varrer,vɐ.ˈReɾ,sweep,verb,Macao creole,,,"Barro, varrer. Barido, varrido. Dial. mac. barè.",varrer,,139.0
222,Batrai,batɾai,bateria,bɐ.tɨ.ˈɾi.ɐ,battery,noun,,,"O Bruffador, i periódico","Batrai {Br. i), bateria.",bateria,,139.0
223,Battà,batːaː,bater,bɐ.ˈteɾ,knock,verb,,,,"Battà, bater.",bater,,139.0
224,Battalho,batːaʎo,batalha,bɐ.ˈta.ʎɐ,battle,noun,,,Cantigas,Battalho [Cant.)batalha. V. BACI.Á.,batalha,,139.0
227,Bautizá,bautizaː,batizar,ba.ti.ˈzaɾ,baptize,verb,,,,,baptizar,,
236,Beberão,bebeɾaːo,beberrão,bɨ.bɨ.ˈRɐ̃w̃,drunkard,noun,,,,"Beberão, babarão, bebrâo, beberrão.",beberrão,,139.0
237,babarão,babaɾaːo,beberrão,bɨ.bɨ.ˈRɐ̃w̃,drunkard,noun,,,,"Beberão, babarão, bebrâo, beberrão.",beberrão,,139.0
238,bebrão,bebɾaːo,beberrão,bɨ.bɨ.ˈRɐ̃w̃,drunkard,noun,,,,"Beberão, babarão, bebrâo, beberrão.",beberrão,,139.0
240,Béço,beːso,beiço,ˈbɐj.su,lip,noun,,,,,beiço,,
245,Bença,bensa,bênção,ˈbẽ.swɐ̃w̃,blessing,noun,"Cochin creole, Macao creole",,,"Bença, bencè, benção. Ben-ça: dial. cochmac.",benção,,140.0
246,bencè,benseː,bênção,ˈbẽ.swɐ̃w̃,blessing,noun,"Cochin creole, Macao creole",,,"Bença, bencè, benção. Ben-ça: dial. cochmac.",benção,,140.0
247,Bendição,bendisaːo,bênção,ˈbẽ.swɐ̃w̃,blessing,noun,,Old Portuguese,,"Bendição, benção. — Port. arch..-'",benção,,140.0
248,Beneficaçan,benefikasan,benefício,bɨ.nɨ.ˈfi.sju,benefit,noun,,,,"Beneflcaçan {C. .4.), beneficio.",beneficio,,140.0
252,Bénza,beːnza,bênção,ˈbẽ.swɐ̃w̃,blessing,noun,,,,,benção,,
253,bénzè,beːnzeː,bênção,ˈbẽ.swɐ̃w̃,blessing,noun,,,,,benção,,
261,Bijá,bid̠ʒaː,beijar,bɐj.ˈʒaɾ,kiss,verb,"Diu creole, Mangalor creole",,,"Bijá, beijar. Dial. mangdiv.",beijar,,140.0
265,Bisiga,biziga,bexiga,bɨ.ˈʃi.ɡɐ,bladder,noun,,,,"Bisiga, bexiga.",bexiga,,140.0
271,Blasphemoso,blasfemozo,blasfemo,blɐʃ.ˈfe.mu,blasphemous,noun,,,,"Blasphemoso, blasphemo. Cfr. alegroso, impioso.",blasphemo,,140.0
272,Bõa,boːa,boa,ˈbo.ɐ,good,adjective,,Old Portuguese,,"Boa (Gomes), boa. — Port. arch.",boa,,140.0
275,Bocadè,bokadeː,bocado,bu.ˈka.du,bite size,noun,,,,"Bocadè, bocado.",bocado,,140.0
282,Bom,bom,bem,bɐ̃j̃,well,adverb,,,,"Bom, bom: bem {siibst.).",bem,,140.0
286,Bordè,boɾdeː,borda,ˈbɔɾ.dɐ,edge,noun,,,,"Borde, borda.",borda,,140.0
287,Bordiá,boɾdiaː,bordar,buɾ.ˈdaɾ,embroider,verb,,,,"Bordiá, bordar.",bordar,,140.0
288,Borrecido,boresido,aborrecido,ɐ.bu.Rɨ.ˈsi.du,bored,adjective,Macao creole,,Istori de San Clear,"Borrecido, aborrecido. Dial. mac. borecido. P. us. Cfr. biircê.",aborrecido,pouco usado,140.0
294,Boutic,boutik,botica,bu.ˈti.kɐ,pharmacy,noun,,"Old Portuguese, All Portuguese-based creoles of India",,Boutique (pron. boutic)^ botica (pharmacia), loja. — Botica na segunda accep. port. arch. Comm. (t. em Macao creole e Gôa).,botica,141.0
300,Branca,bɾanka,branquear,bɾɐ̃.ˈki.aɾ,bleach,verb,,,,"Branca, branquear. — De branco.",branquear,,141.0
301,Branda,bɾanda,abrandar,ɐ.bɾɐ̃.ˈdaɾ,slow down,verb,"Capeverdean creole, Macao creole",,,"Branda, abrandar. Dial. mac, cab.",abrandar,,141.0
303,Branquéza,bɾankeːza,brancura,bɾɐ̃.ˈku.ɾɐ,whiteness,noun,,,,"Branquéza, brancura.",brancura,,141.0
307,Brazá,bɾazaː,abrasar,ɐ.bɾɐ.ˈzaɾ,blaze,verb,,,,"Brazá, abrazar.",abrazar,,141.0
308,Bremellio,bɾemelio,vermelho,vɨɾ.ˈmɐj.ʎu,red,adjective,Capeverdean creole,,,"Bremellio, brimellio, bri-malho, brimejo, vermelho, Dial. cab. brumêjo. Burmelho, brumelho: dialectal no cdnt.",vermelho,,141.0
309,brimellio,bɾimelio,vermelho,vɨɾ.ˈmɐj.ʎu,red,adjective,Capeverdean creole,,,"Bremellio, brimellio, bri-malho, brimejo, vermelho, Dial. cab. brumêjo. Burmelho, brumelho: dialectal no cdnt.",vermelho,,141.0
310,brimalho,bɾimaʎo,vermelho,vɨɾ.ˈmɐj.ʎu,red,adjective,Capeverdean creole,,,"Bremellio, brimellio, bri-malho, brimejo, vermelho, Dial. cab. brumêjo. Burmelho, brumelho: dialectal no cdnt.",vermelho,,141.0
311,brimejo,bɾimed̠ʒo,vermelho,vɨɾ.ˈmɐj.ʎu,red,adjective,Capeverdean creole,,,"Bremellio, brimellio, bri-malho, brimejo, vermelho, Dial. cab. brumêjo. Burmelho, brumelho: dialectal no cdnt.",vermelho,,141.0
315,Bruffador,bɾufadoɾ,semeador,sɨ.mjɐ.ˈdoɾ,seeder,noun,,,,,semeador,,
320,Bunaca,bunaka,boneca,bu.ˈnɛ.kɐ,doll,adjective,,,,"Bnnaca, boneca.",boneca,,141.0
321,Bunito,bunito,bonito,bu.ˈni.tu,handsome,adjective,Cochin creole,,,"Bunito, bonito. Dial. coch.",bonito,,141.0
323,Burcê,buɾseː,aborrecer,ɐ.bu.Rɨ.ˈseɾ,annoy,verb,Macao creole,,,"Burcô, burçá, abhorrecer. Dial. mac. burecê.",aborrecer,,141.0
324,burçá,buɾsaː,aborrecer,ɐ.bu.Rɨ.ˈseɾ,annoy,verb,Macao creole,,,"Burcô, burçá, abhorrecer. Dial. mac. burecê.",aborrecer,,141.0
333,Cabeça,kabesa,cabeça,kɐ.ˈbe.sɐ,head,noun,Capeverdean creole,,,"Cabeça, cabeçè, cabeça. Cabeça: dial. cab.",cabeça,,141.0
334,cabeçé,kabeseː,cabeça,kɐ.ˈbe.sɐ,head,noun,Capeverdean creole,,,"Cabeça, cabeçè, cabeça. Cabeça: dial. cab.",cabeça,,141.0
335,Cabelho,kabeʎo,cabelo,kɐ.ˈbe.lu,hair,noun,,,,"Cabelho, cabello (mais us.).",cabello,,141.0
341,Cachorinho,kat̠ʃoɾiɲo,cachorro,kɐ.ˈʃo.Ru,dog,noun,,,,,cachorro,,
346,Cadè,kadeː,cada,ˈkɐ.dɐ,each,pronoun,,,,"Cadè, cada (t. us.).",cada,,141.0
347,Cadéra,kadeːɾa,cadeira,kɐ.ˈdɐj.ɾɐ,chair,noun,Macao creole,,,"Cadéra, cadeira. Dial. mac.",cadeira,,142.0
348,Cadia,kadia,cadeia,kɐ.ˈdɐj.ɐ,jail,noun,Mangalor creole,,,"Cadia, cadeia. Dial. mang. Gfr. ária, ai dia.",cadeia,,142.0
353,Caix,kaiʃ,caixa,ˈkaj.ʃɐ,box,noun,,,"O Bruffador, ii periódico","Caix {Br. 2), caixa. V. cassa.",caixa,,142.0
355,Càlis,kaːlis,cálice,ˈka.li.sɨ,cup,noun,,,,"Oàlis, cálix. Calizes, cálices.",cálix,,142.0
356,Calmo,kalmo,calma,ˈkaɫ.mɐ,calm,noun,,,,"Calmo, calma.",calma,,142.0
360,Cambiador,kambiadoɾ,cambista,kɐ̃.ˈbiʃ.tɐ,money broker,noun,,Old Portuguese,,"Cambiador, cambista. — Port. arch. cambador.",cambista,,142.0
370,Canàlhi,kanaːʎi,canalha,kɐ.ˈna.ʎɐ,scoundrel!,noun,,,"O Bruffador, ii periódico","Canàlhi [Br. 2), canalha.",canalha,,142.0
373,Candecera,kandeseɾa,candeeiro,kɐ̃.ˈdjɐj.ɾu,lamp,noun,,,,"Candecera, can'cera (fir.i), candieiro.",candieiro,,142.0
374,can'cera,kanəseɾa,candeeiro,kɐ̃.ˈdjɐj.ɾu,lamp,noun,,,,"Candecera, can'cera (fir.i), candieiro.",candieiro,,142.0
377,Cândia,kaːndia,candeia,kɐ̃.ˈdɐj.ɐ,lamp,noun,Macao creole,,,"Cândia, candeia. Dial. mac. Cfr. ária, cadia.",candeia,,142.0
378,Canto,kanto,quanto,ˈkwɐ̃.tu,quanto,adverb,Capeverdean creole,"Old Portuguese, Dialectal Portuguese",,"Canto, quanto. Dial. cab.— Port. arch. e Dialetal Portuguese.",quanto,,142.0
380,Capas,kapas,capaz,kɐ.ˈpaʃ,able,adjective,,,,"Capas, capaz (t. us.). Capa-zidade, eapazdade, capacidade.",capaz,,142.0
382,Captão,kaptaːo,capitão,kɐ.pi.ˈtɐ̃w̃,captain,noun,,,"O Bruffador, ii periódico","Captão, capitano (Br. 2), capitão.",capitão,,142.0
383,capitano,kapitano,capitão,kɐ.pi.ˈtɐ̃w̃,captain,noun,,,"O Bruffador, ii periódico","Captão, capitano (Br. 2), capitão.",capitão,,142.0
384,Caravão,kaɾaʋaːo,carvão,kɐɾ.ˈvɐ̃w̃,charcoal,noun,,,,"Caravão, carvão. Svara-bhakti. Cfr. oravai.",carvão,,142.0
387,Cargá,kaɾgaː,carregar,kɐ.Rɨ.ˈɡaɾ,load,verb,Macao creole,,,"Carga, carregar. Dial. mac.",carregar,,142.0
388,Cargação,kaɾgasaːo,carregamento,kɐ.Rɨ.ɡɐ.ˈmẽ.tu,load,noun,,,,"Cargação, carregação, carregamento.",carregamento,,142.0
391,Caridavel,kaɾidaʋel,caridoso,kɐ.ɾi.ˈdo.zu,charitable,adjective,,,"O Bruffador, ii periódico","Caridavel {Br. 2), caridoso.",caridoso,,142.0
392,Caringuejo,kaɾinged̠ʒo,caranguejo,kɐ.ɾɐ̃.ˈɡɐj.ʒu,crab,noun,Cochin creole,,,"Caringuejo, caranguejo. Dial. coch.",caranguejo,,142.0
393,Caristia,kaɾistia,carestia,kɐ.ɾɨʃ.ˈti.ɐ,famine,noun,"Diu creole, Mangalor creole",,,"Caristia, oaristi, earres-tia, carestia. Caristi: dial. div. Dial. mang. carestí. Cfr. allegri.",carestia,,143.0
394,caristi,kaɾisti,carestia,kɐ.ɾɨʃ.ˈti.ɐ,famine,noun,"Diu creole, Mangalor creole",,,"Caristia, oaristi, earres-tia, carestia. Caristi: dial. div. Dial. mang. carestí. Cfr. allegri.",carestia,,143.0
395,carrestia,karestia,carestia,kɐ.ɾɨʃ.ˈti.ɐ,famine,noun,"Diu creole, Mangalor creole",,,"Caristia, oaristi, earres-tia, carestia. Caristi: dial. div. Dial. mang. carestí. Cfr. allegri.",carestia,,143.0
402,Cartè,kaɾteː,carta,ˈkaɾ.tɐ,letter,noun,,,,"Carte, carta (mais us.).",carta,,143.0
405,Casião,kaziaːo,ocasião,ɔ.kɐ.ˈzjɐ̃w̃,occasion,noun,,,,"Casião, cassião, occasião. Cfr. cupaçáo.",occasião,,143.0
406,Cassa,kasa,caixa,ˈkaj.ʃɐ,box,noun,,,,"Cassa, caixa. Cassâo, caixão.",caixa,,143.0
408,Castella,kastela,castelo,kɐʃ.ˈtɛ.lu,castle,noun,,,,"Castella, castellé, castello.",castello,,143.0
409,castellé,kasteleː,castelo,kɐʃ.ˈtɛ.lu,castle,noun,,,,"Castella, castellé, castello.",castello,,143.0
410,Castigação,kastigasaːo,castigo,kɐʃ.ˈti.ɡu,punishment,noun,,,,Castigaçâo (C A.)^ castigo.,castigo,,143.0
412,Catividade,katiʋidade,cativeiro,kɐ.ti.ˈvɐj.ɾu,captivity,noun,,,,"Catividade, captiveiro. Cfr. duvidade, sobredade.",captiveiro,,143.0
413,Catàrr,kataːr,catarro,kɐ.ˈta.Ru,catarrh,noun,,,,"Catàrr, catarrho. Cfr. pelour.",catarrho,,143.0
414,Causo,kauzo,causa,ˈkaw.zɐ,cause,noun,,,,"Causo, causa. Causedor, causador.",causa,,143.0
416,Cavalheria,kaʋaʎeɾia,cavalaria,kɐ.vɐ.lɐ.ˈɾi.ɐ,armoured corps,noun,,,,"Cavalheria, cavallaria.",cavallaria,,143.0
418,Cavelyéro,kaʋelʲeːɾo,cavalheiro,kɐ.vɐ.ˈʎɐj.ɾu,gentleman,noun,,,,"Caveljéro, cavalheiro. Cfr. filjo, iljarga.",cavalheiro,,143.0
419,Cavelo,kaʋelo,cabelo,kɐ.ˈbe.lu,hair,noun,,,,"Cavelo, cavelho, cabello.",cabello,,143.0
420,Caverno,kaʋeɾno,caverna,kɐ.ˈvɛɾ.nɐ,cavern,noun,,,,"Caverno, caverna.",caverna,,143.0
421,Caxa,kaʃa,queixa,ˈkɐj.ʃɐ,complaint,noun,,,,"Caxa {Br. 2), queixa. V.",queixa,,143.0
422,Cendê,sendeː,acender,ɐ.sẽ.ˈdeɾ,light,verb,,,,"Cendô (A^. T.), accender. V.",accender,,143.0
426,Ceremonio,seɾemonio,cerimónia,sɨ.ɾi.ˈmɔ.njɐ,ceremony,noun,,,,"Ceremonio, cerimonia.",cerimonia,,143.0
431,Chalo,t̠ʃalo,chalé,ʃa.ˈlɛ,chalet,noun,,,,"Chalo, chalé.",chalé,,143.0
434,Chápè,t̠ʃaːpeː,chapa,ˈʃa.pɐ,sheet,noun,,,,"Chápè, chapa (t, us.); sello.",chapa,,143.0
435,Chape,t̠ʃape,chapéu,ʃɐ.ˈpɛw,hat,noun,"Capeverdean creole, Diu creole",,,"Chape, chapéu. Dial. divde Mahé, cab.",chapéu,,143.0
438,Chéo,t̠ʃeːo,cheio,ˈʃɐj.u,full,adjective,Macao creole,,,"Chéo, cheio. Dial. mac. Cfr. féo, viéo.",cheio,,143.0
439,Chéro,t̠ʃeːɾo,cheiro,ˈʃɐj.ɾu,odour,noun,,,,"Chéro, chiero, chiesto, cbisto, cheiro. Chisto, cheiroso, odoroso.",cheiro,,143.0
440,chiero,t̠ʃieɾo,cheiro,ˈʃɐj.ɾu,odour,noun,,,,"Chéro, chiero, chiesto, cbisto, cheiro. Chisto, cheiroso, odoroso.",cheiro,,143.0
441,chiesto,t̠ʃiesto,cheiro,ˈʃɐj.ɾu,odour,noun,,,,"Chéro, chiero, chiesto, cbisto, cheiro. Chisto, cheiroso, odoroso.",cheiro,,143.0
442,chisto,t̠ʃisto,cheiro,ˈʃɐj.ɾu,odour,noun,,,,"Chéro, chiero, chiesto, cbisto, cheiro. Chisto, cheiroso, odoroso.",cheiro,,143.0
454,Chocarréa,t̠ʃokareːa,chocarrice,ʃu.kɐ.ˈRi.sɨ,jest,noun,,,,"Ohocarréa,choqueria, choca rrice.",chocarrice,,144.0
455,choqueria,t̠ʃokeɾia,chocarrice,ʃu.kɐ.ˈRi.sɨ,jest,noun,,,,"Ohocarréa,choqueria, choca rrice.",chocarrice,,144.0
456,Chomà,t̠ʃomaː,chamar,ʃɐ.ˈmaɾ,call,verb,"Capeverdean creole, Marathi",Dialectal Portuguese,,"Chomà, chamar. Dial. mac, cab. Chóma, chamamento; vocação.— Port. Dialetal Portuguese. chomar ou chiimar.",chamar,,144.0
457,Chóma,t̠ʃoːma,chamamento,ʃɐ.mɐ.ˈmẽ.tu,calling,noun,,,,,chamamento,,
470,Cinquo,sinkuo,cinco,ˈsĩ.ku,five,numeral,,Old Portuguese,,"Cinquo, cinquè, cinco (mais us.). Cinquento, cincoenta (t. us.). Cinquo: port. arch.",cinco,,144.0
471,cinquè,sinkeː,cinco,ˈsĩ.ku,five,numeral,,Old Portuguese,,"Cinquo, cinquè, cinco (mais us.). Cinquento, cincoenta (t. us.). Cinquo: port. arch.",cinco,,144.0
480,Clar,klaɾ,claro,ˈkla.ɾu,clear,adjective,,,,"Ciar, claro. Clarmente, claramente. Cfr. desempar.",claro,,144.0
481,Clarmente,klaɾmente,claramente,kla.ɾɐ.ˈmẽ.tɨ,clearly,adverb,,,,,claramente,,
485,Coidá,kojdaː,cuidar,kuj.ˈdaɾ,care,verb,,,,"Coidá, cuidar (mais us.). Coidado, cuidado.",cuidar,,144.0
486,Coidado,kojdado,cuidado,kuj.ˈda.du,caution,noun,,,,,cuidado,,
487,Çoità,sojtaː,açoitar,ɐ.soj.ˈtaɾ,flog,verb,,,,"Çoità, açoitar.",açoitar,,144.0
